event-Icg4419,user-ZKt668157,Art Festival : Shining,images/events/2023-10-11_1697001425138.png,Art,2023/10/19 10:00:00,2023/11/03 18:00:00,สำหรับคนชอบศิลปะ,Rimberio Gallery,100000,2023/10/11 12:18:21,2023/10/19 10:00:00,2023/11/03 18:00:00
event-dgV894495,user-CPY010245,COMMART CRAZY DEAL,images/events/2023-10-13_1697137418560.png,Business,2023/07/06 10:00:00,2023/07/09 21:00:00,"  งานมหกรรมสินค้าไอที โปรโมชั่นส่วนลด ของแถมจัดเต็ม ""Commart Thailand 2023"" จัดปีละ 3 ครั้ง งานมหกรรมสินค้าไอทีระดับประเทศที่ทุกคนรอคอย กับการจัดเต็มเทคโนโลยีใหม่ล่าสุด ครบทั้งโน้ตบุ๊ก  คอมพิวเตอร์ DIY  สมาร์ทโฟน  แท็บแล็ต  สมาร์ตโฮม  เกม  เกตเจ็ต  พริ้นเตอร์ และซอฟต์แวร์ และสินค้าไอที Rare Item พร้อมโปรโมชั่นลดหนัก จัดเต็ม จากร้านใหญ่ที่ทุกคนคุ้นเคย Advice  Banana  IT City  JIB  JayMART  SPVi  Studio7 เป็นต้น เจอกันที่เดิม! EH 98-99 ไบเทค บางนา ",ไบเทค บางนา EH 98-99,1000,2023/01/01 00:44:12,2023/07/06 10:00:00,2023/07/09 21:00:00
event-GhE214301,user-PLr359096,Commart Thailand,images/events/2023-10-13_1697137794692.jpg,Art,2023/11/30 10:00:00,2023/12/03 21:00:00,งานมหกรรมสินค้าไอที โปรโมชั่นส่วนลด ของแถมจัดเต็ม "Commart Thailand 2023" จัดปีละ 3 ครั้ง งานมหกรรมสินค้าไอทีระดับประเทศที่ทุกคนรอคอย กับการจัดเต็มเทคโนโลยีใหม่ล่าสุด ครบทั้งโน้ตบุ๊ก  คอมพิวเตอร์ DIY  สมาร์ทโฟน  แท็บแล็ต  สมาร์ตโฮม  เกม  เกตเจ็ต  พริ้นเตอร์ และซอฟต์แวร์ และสินค้าไอที Rare Item พร้อมโปรโมชั่นลดหนัก จัดเต็ม จากร้านใหญ่ที่ทุกคนคุ้นเคย Advice  Banana  IT City  JIB  JayMART  SPVi  Studio7 เป็นต้น เจอกันที่เดิม! EH 98-99 ไบเทค บางนา,ไบเทค บางนา EH 98-99,100,2023/10/13 01:54:42,2023/11/25 12:00:00,2023/12/03 20:30:00
event-ZDY963124,user-teM342866,Living Festival 2023,images/events/2023-10-11_1696958256883.jpg,Business,2023/10/14 10:00:00,2023/10/21 21:00:00,งานแสดงและขายสินค้าครบวงจรที่เกี่ยวกับบ้านและสวน บนพื้นที่ต่อเนื่องและยิ่งใหญ่กว่าทุกปี ทั้งในเชิง Design Living และ Outdoor Living รวมทั้งนิทรรศการและกิจกรรมที่ให้ความรู้ข่าวสาร ข้อมูลที่เกี่ยวกับที่อยู่อาศัย ให้ความเพลิดเพลินแก่คนรักบ้าน ประดุจเดินเข้าไปในนิตยสารบ้านและสวน,Challenger 1-3 อิมแพ็ค เมืองทองธานี,500,2023/10/11 00:18:17,2023/10/11 10:00:00,2023/10/21 20:00:00
event-ZYL919558,user-ZKt668157,Music Festival 2023 : Dancing,images/events/2023-10-11_1697000484221.png,Music,2023/10/12 11:00:00,2024/01/14 01:59:00,go to dance on the floor together!,LA,350,2023/10/11 12:02:50,2023/10/12 11:00:00,2024/01/14 01:59:00
event-jKH646243,user-DEV010245,ONE STOP SHOPPING EXPO 2023,images/events/2023-10-10_1696933405354.jpg,Business,2023/10/21 10:30:00,2023/10/28 21:00:00,1. Furniture Expo: เฟอร์นิเจอร์ และสินค้าตกแต่งบ้าน ที่นอน ตู้ เตียง โซฟา สินค้าตกแต่งบ้าน เฟอร์นิเจอร์บิวท์อิน ชุดห้องนอน ชุดรับแขก ชุดโต๊ะรับประทานอาหาร และผ้าม่าน ราคาสุดคุ้มเฉพาะงานนี้เท่านั้น 2. Electronics Expo: เปิดมิติใหม่เครื่องใช้ไฟฟ้า ลดหนัก สูงสุด 40-70% ทีวี แอร์ ตู้เย็น เครื่องใช้ไฟฟ้า เครื่องซักผ้า ไดร์เป่าผม เครื่องฟอกอากาศ เครื่องดูดฝุ่น เครื่องปั่นน้ำผลไม้ เตารีด เตาไฟฟ้า เครื่องทำน้ำอุ่น มาพร้อมโปรโมชั่น ผ่อน 0%   รับเครดิตเงินคืน ครบในงานเดียว! 3. Wedding Expo: แพ็คเกจแต่งงาน ชุดแต่งงาน เวดดิ้งสตูดิโอ ถ่ายภาพงานแต่ง และอื่นๆ มีหลากหลาย ตอบทุกโจทย์ของคู่รัก ในราคาที่เป็นกันเอง 4. ตลาดน้ำ ตำนานอร่อย: ยกทัพความอร่อยที่มีทั้งอาหารโบราณ ขนม ของกินคาวหวาน ในบรรยากาศย้อนยุค ย้อนสมัย ของฝากเพียบ,IMPACT เมืองทองธานี,500,2023/10/10 17:23:28,2023/10/21 10:30:00,2023/10/28 21:00:00
event-pSm366471,user-ZKt668157,after work party,images/events/2023-10-11_1697000581604.png,Music,2023/10/12 12:15:00,2023/11/12 11:18:00,,KU Thailand,50,2023/10/11 12:03:36,2023/10/12 12:15:00,2023/11/12 11:18:00
event-PNl526932,user-iIP330521,kaset fair 2565,images/events/2023-10-11_1697025932586.jpg,Business,2023/10/12 00:00:00,2023/10/31 00:00:00,มาชิม ช็อป ใช้ ที่เกษตรแฟร์,มหาวิทยาลัยเกษตรศาสตร์,1000,2023/10/11 19:06:05,2023/10/12 00:00:00,2023/10/31 00:00:00
event-jEH334223,user-iIP330521,ragnarok meeting 2566,images/events/2023-10-12_1697083521018.jpg,Business,2023/10/15 00:00:00,2024/12/29 00:00:00,มาร่วมเล่นเกม ragnarok ในงานแล้วลุ้นรับของรางวัลมูลค่ารวมกว่า 50 ล้านบาท งานใหญ่งานนี้ห้ามพลาดดด!!,มหาวิทยาลัยเกษตรศาสตร์,10000,2023/10/12 11:05:21,2023/10/15 00:00:00,2024/12/29 00:00:00
